{
  "id": "ded1f00effca1d04882665641d73512f52d6",
  "project": "dedalo",
  "created_at": 1787342924,
  "asset": {
    "symbol": "USDC",
    "decimals": 6,
    "chain": "base",
    "contract": "0x833589fCD6eDb6E08f4c7C32D4f71b54bdA02913"
  },
  "range": {
    "branch": "main",
    "to_commit": "0769e06a2cde50b90e729d84fb77432f04748e60",
    "merges": 2
  },
  "split": {
    "gross": "1000000000",
    "protocol": "25000000",
    "treasury": "150000000",
    "contributors": "825000000"
  },
  "items": [
    {
      "kind": "treasury",
      "handle": "treasury",
      "wallet": "0x0000000000000000000000000000000000000000",
      "amount": "150000000",
      "score": 0,
      "share_bps": 1500
    },
    {
      "kind": "protocol",
      "handle": "dedalo",
      "wallet": "0x0000000000000000000000000000000000000000",
      "amount": "25000000",
      "score": 0,
      "share_bps": 250
    }
  ],
  "undistributed": "825000000",
  "unresolved": [
    {
      "name": "4137314",
      "email": "mattia.fait@email.com",
      "score": 2721895,
      "reason": "no-wallet"
    },
    {
      "name": "Claude Opus 5",
      "email": "noreply@anthropic.com",
      "score": 2331605,
      "reason": "no-wallet"
    }
  ]
}